{
  "aciklama_md": "Bu sevkiyatın toplam fiyatı 2.340,0 USD olarak hesaplandı. Fiyatın büyük bölümü iki kalemden oluşuyor: temel fiyat 1.200,0 USD, mesafe kademesi ise 1.450 km uzaklık nedeniyle 840,0 USD ek getirdi. Bunun üstüne 45 derece eğim kuralı nedeniyle 300,0 USD surcharge eklendi. Ağırlık 520,0 kg olarak sisteme girildi.",
  "karar_tipi": "fiyat",
  "kullanilan_girdiler": ["nihai_fiyat_usd", "fiyat_kalemleri", "toplam_agirlik_kg", "mesafe_km"],
  "topraklama_uyarisi": false
}
